925	Choose <b>will</b> or <b>won't</b>.	Can you wait for me? {{c1::I won't}} be long.	I'll / I won't			
926	Choose <b>will</b> or <b>won't</b>.	I'm glad I'm meeting Emily tomorrow. {{c1::It will}} be good to see her again.	It will / It won't			
927	Choose <b>will</b> or <b>won't</b>.	It's no good asking Amy for advice. {{c1::She won't}} know what to do.	She'll / She won't			
928	Choose <b>will</b> or <b>won't</b>.	I'm sorry about what happened. {{c1::It won't}} happen again.	It will / It won't			
929	Choose <b>will</b> or <b>won't</b>.	We don't need to take an umbrella.<br />I don't think {{c1::it will}} rain.	it will / it won't			
930	Choose <b>will</b> or <b>won't</b>.	I've got some incredible news. {{c1::You won't}} believe it.	You'll / You won't			
931	Choose <b>will</b> or <b>won't</b>.	It's a very nice hotel. {{c1::You'll}} enjoy your stay here.	You'll / You won't			
932	Choose <b>will</b> or <b>won't</b>.	I can't meet you tomorrow. {{c1::I won't}} have time.	I'll / I won't			
