851	Make questions with <b>going to</b>. Put the words in order.	Your friend is going to a party tonight.<br />You ask:<br />What {{c1::are}} {{c1::you}} {{c1::going}} {{c1::to}} {{c1::wear}} (you / to / going / wear / are)?				
852	Make questions with <b>going to</b>. Put the words in order.	Your friend has won some money.<br />You ask:<br />What {{c1::are}} {{c1::you}} {{c1::going}} {{c1::to}} {{c1::do}} {{c1::with}} {{c1::it}} (going / it / are / to / you / with / do)?				
853	Make questions with <b>going to</b>. Put the words in order.	Your friend has just bought a new table.<br />You ask:<br />Where {{c1::are}} {{c1::you}} {{c1::going}} {{c1::to}} {{c1::put}} {{c1::it}} (put / you / it / going / are / to)?				
854	Make questions with <b>going to</b>. Put the words in order.	Your friend has decided to have a party.<br />You ask:<br />Who {{c1::are}} {{c1::you}} {{c1::going}} {{c1::to}} {{c1::invite}} (to / you / invite / are / going)?				
855	Make questions with <b>going to</b>. Put the words in order.	Your friend is going to London for a few days.<br />You ask:<br />Where {{c1::are}} {{c1::you}} {{c1::going}} {{c1::to}} {{c1::stay}} (stay / you / to / going / are)?				
856	Make questions with <b>going to</b>. Put the words in order.	Your friend has bought some fish for dinner.<br />You ask:<br />How {{c1::are}} {{c1::you}} {{c1::going}} {{c1::to}} {{c1::cook}} {{c1::it}} (you / cook / going / it / to / are)?				
